FHDI_Food_ID,Food_Name,Scientific_Name,Common_Name,Description,Group,Subgroup,ITIS_ID,FoodB_ID,DTU_ID,Taxonomy_ID,Superkingdom,Kingdom,Phylum,Class,Order,Family,Genus,Drug homologous food
F00130,Folic Acid,NA,NA,"Folic acid is a derivative of pteridine, initially isolated from the liver, but later found to be very abundant in the green leaves of plants, hence the name folic acid. It is widely found in meat, fresh fruits, and vegetables. It is a yellow crystalline powder, odorless and tasteless. Its sodium salt is easily soluble in water, insoluble in alcohol, ether, and other organic solvents. It is insoluble in cold water but slightly soluble in hot water. It is unstable in acidic solutions and easily damaged by light.",Others,Chemical Compound,NA,NA,NA,NA,NA,NA,NA,NA,NA,NA,NA,NA
F00131,Low-Protein Meal,NA,NA,Low-Protein Meal refers to a diet with lower protein content.,Food combination,Low-Protein Meal,NA,NA,NA,NA,NA,NA,NA,NA,NA,NA,NA,NA
F00132,Mexican Diet Meal,NA,NA,"Mexican diet which consisted of two fried eggs with tomato, onion and chili, two slices of bacon, chilaquiles (tortillas (55 g) with tomato, chili and cream (12 g) and a glass of milk (240 ml) (fat 57.1%, protein 16%, carbohydrates 26%, 963.5 kcal).",Food combination,Speciality Diets,NA,NA,NA,NA,NA,NA,NA,NA,NA,NA,NA,NA
F00133,"High-Carbohydrate, Low-Protein Meal",NA,NA,"High-Carbohydrate, Low-Protein Meal refers to a diet with lower protein content and higher carbohydrate content.",Food combination,High-Carbohydrate Meal,NA,NA,NA,NA,NA,NA,NA,NA,NA,NA,NA,NA
F00134,High-Carbohydrate Meal,NA,NA,High-Carbohydrate Meal refers to a diet with higher carbohydrate content.,Food combination,High-Carbohydrate Meal,NA,NA,NA,NA,NA,NA,NA,NA,NA,NA,NA,NA
F00135,"High-Calcium, Moderate-Fat, Moderate-Caloric Meal",NA,NA,"High-Calcium, Moderate-Fat, Moderate-Caloric Meal refers to a diet with moderate caloric, higher calcium content and moderate fat content.",Food combination,Moderate-Fat Meal,NA,NA,NA,NA,NA,NA,NA,NA,NA,NA,NA,NA
F00136,500-Caloric Well-Balanced Meal,NA,NA,"A well-balanced 500-calorie meal (WB500), a well-balanced 250-calorie meal (WB250), a 250-calorie high-fat meal (HF250). A well-balanced meal was defined as approximately 55% carbohydrates, 30% fat and 15% protein, whereas a high-fat meal contained approximately 30% carbohydrates, 50% fat and 20% protein. ",Food combination,Well-Balanced Meal,NA,NA,NA,NA,NA,NA,NA,NA,NA,NA,NA,NA
F00137,250-Caloric Well-Balanced Meal,NA,NA,"A well-balanced 500-calorie meal (WB500), a well-balanced 250-calorie meal (WB250), a 250-calorie high-fat meal (HF250). A well-balanced meal was defined as approximately 55% carbohydrates, 30% fat and 15% protein, whereas a high-fat meal contained approximately 30% carbohydrates, 50% fat and 20% protein. ",Food combination,Well-Balanced Meal,NA,NA,NA,NA,NA,NA,NA,NA,NA,NA,NA,NA
F00138,250-Caloric Well-Balanced Liquid Meal,NA,NA,"A well-balanced 500-calorie meal (WB500), a well-balanced 250-calorie meal (WB250), a 250-calorie high-fat meal (HF250). A well-balanced meal was defined as approximately 55% carbohydrates, 30% fat and 15% protein, whereas a high-fat meal contained approximately 30% carbohydrates, 50% fat and 20% protein. ",Food combination,Well-Balanced Meal,NA,NA,NA,NA,NA,NA,NA,NA,NA,NA,NA,NA
F00139,250-Caloric High-Fat Meal,NA,NA,"The liquid meal replacement supplement consisted of a 250-mL vanilla Ensure (250 calories, 54% carbohydrates, 30% fat and 16% protein). 250-calorie liquid meal supplement (Ensure; Ensure; Abbott Nutrition, Columbus, OH, USA).",Food combination,High-Fat Meal,NA,NA,NA,NA,NA,NA,NA,NA,NA,NA,NA,NA
F00140,Protein-Rich Drink Meal,NA,NA,"In normal-fat meal, fat accounted for approximately 189 of total calories, Carbohydrate 268 kCal, Protein 76 kCal In Protein-rich drink (Ensure), fat accounted for approximately 72 of total calories, Carbohydrate 153 kCal, Protein 75 kCal",Food combination,Liquid Meal,NA,NA,NA,NA,NA,NA,NA,NA,NA,NA,NA,NA
F00141,Liquid Meal,NA,NA,"A liquid diet consists only of liquids instead of solid food. This includes homemade or store-bought juices and smoothies, homemade protein shakes, premade protein shakes and store-bought liquid meal replacements.",Food combination,Liquid Meal,NA,NA,NA,NA,NA,NA,NA,NA,NA,NA,NA,NA
F00142,Light Meal,NA,NA,"Light meals with low calories, low fat and high fiber have become very popular in world.",Food combination,Speciality Diets,NA,NA,NA,NA,NA,NA,NA,NA,NA,NA,NA,NA
F00143,Homogenized Meal,NA,NA,"Homogenized Meal have 400 ml,caloric value 490 kCal, made up of 50% carbohydrate, 30% lipid, 20% protein",Food combination,Speciality Diets,NA,NA,NA,NA,NA,NA,NA,NA,NA,NA,NA,NA
F00144,High-Purine Meal,NA,NA,High-Purine Meal refers to a diet with higher purine content.,Food combination,High-Purine Meal,NA,NA,NA,NA,NA,NA,NA,NA,NA,NA,NA,NA
F00145,High-Protein Meal,NA,NA,High-Protein Meal refers to a diet with higher protein content.,Food combination,High-Protein Meal,NA,NA,NA,NA,NA,NA,NA,NA,NA,NA,NA,NA
F00146,High-Fiber Meal,NA,NA,"High-Fiber Meal, also known as a high residue diet, refers to a diet that contains more dietary fiber.",Food combination,High-Fiber Meal,NA,NA,NA,NA,NA,NA,NA,NA,NA,NA,NA,NA
F00147,"High-Fat, Vegetarian Meal",NA,NA,"High-Fat, Vegetarian Meal refers to a vegetarian diet with higher fat content.",Food combination,High-Fat Meal,NA,NA,NA,NA,NA,NA,NA,NA,NA,NA,NA,NA
F00148,"High-Fat, Non-Vegetarian Meal",NA,NA,"High-Fat, Non-Vegetarian Meal refers to a non-vegetarian diet with higher fat content.",Food combination,High-Fat Meal,NA,NA,NA,NA,NA,NA,NA,NA,NA,NA,NA,NA
F00149,"High-Fat, Non-Dairy Meal",NA,NA,"High-Fat, Non-dairy Meal refers to a Non-dairy diet with higher fat content.",Food combination,High-Fat Meal,NA,NA,NA,NA,NA,NA,NA,NA,NA,NA,NA,NA
F00150,"High-Fat, Low-Calcium Meal",NA,NA,"High-Fat, Low-Calcium Meal refers to a diet with higher fat ratio and lower calcium content.",Food combination,High-Fat Meal,NA,NA,NA,NA,NA,NA,NA,NA,NA,NA,NA,NA
F00151,"High-Fat, High-Calcium Meal",NA,NA,"High-Fat, High-Calcium Meal refers to a diet with higher fat ratio and higher calcium content.",Food combination,High-Fat Meal,NA,NA,NA,NA,NA,NA,NA,NA,NA,NA,NA,NA
F00152,High-Caloric Meal,NA,NA,High-Caloric Meal refers to a diet with High Caloric.,Food combination,High-Caloric Meal,NA,NA,NA,NA,NA,NA,NA,NA,NA,NA,NA,NA
F00153,French Breakfast,NA,NA,French Breakfast is a meal with very low protein content.,Food combination,Speciality Diets,NA,NA,NA,NA,NA,NA,NA,NA,NA,NA,NA,NA
F00154,Evening Meal,NA,NA,"Evening Meal mean supper, around 7pm-9pm.",Food combination,Uncategorised,NA,NA,NA,NA,NA,NA,NA,NA,NA,NA,NA,NA
F00155,Croissant With Coffee,NA,NA,"Croissant with coffee (treatment E: 240 kcal, 12 g fat, 28 g carbohydrate, 5 g protein)",Food combination,Speciality Diets,NA,NA,NA,NA,NA,NA,NA,NA,NA,NA,NA,NA
F00156,Continental Breakfast,NA,NA,"Continental Breakfast is the breakfast method used by the British in the English context to refer to various countries on the European continent. However, over time, the meaning of the word ""continental breakfast"" has now evolved into ""simple breakfast"", which is a simple breakfast that only provides coffee, tea, milk, butter, jam, bread and juice. This kind of breakfast usually does not provide cereal Congee, meat, sausage and eggs.",Food combination,Speciality Diets,NA,NA,NA,NA,NA,NA,NA,NA,NA,NA,NA,NA
F00157,Carbohydrate Meal,NA,NA,Carbohydrate meal refers to a dietary structure that is mainly composed of carbohydrates.,Food combination,Uncategorised,NA,NA,NA,NA,NA,NA,NA,NA,NA,NA,NA,NA
F00158,Flavone,NA,NA,Flavonoids are widely present in natural plants and are secondary metabolites of plants.,Others,Chemical Compound,NA,NA,NA,NA,NA,NA,NA,NA,NA,NA,NA,NA
F00159,Black Mulberry,Morus nigra,NA,"Morus nigra, the black mulberry, is a species of flowering plant in the family Moraceae, native to southwestern Asia, where it has been cultivated for so long that its precise natural range is unknown. The edible fruit is dark purple, almost black, when ripe, 2-3 centimetres (0.8-1.2 in) long, a compound cluster of several small drupes; it is richly flavoured, similar to the red mulberry (Morus rubra) but unlike the more insipid fruit of the white mulberry (Morus alba).",Fruits,Berries,19069,FOOD00117,NA,85232,Eukaryota,Viridiplantae,Streptophyta,Magnoliopsida,Rosales,Moraceae,Morus,"Black mulberry summer fruit ripening and harvesting, can be used to make jam, jelly, syrup and so on."
F00160,Flaxseed,Linum usitatissimum,NA,"Flax (also known as common flax or linseed) is a member of the genus Linum in the family Linaceae. It is a food and fibre crop that is grown in cooler regions of the world. Flax fibres are taken from the stem of the plant and are two to three times as strong as those of cotton. As well, flax fibres are naturally smooth and straight. Europe and North America depended on flax for cloth until the nineteenth century, when cotton overtook flax as the most common plant used for making linen paper. Flax is grown on the Canadian Praires for linseed oil, which is used as a drying oil in paints and varnish and in products such as linoleum and printing inks. It is native to the region extending from the eastern Mediterranean to India and was probably first domesticated in the Fertile Crescent. Flax was extensively cultivated in ancient Ethiopia and ancient Egypt. A discovery reported in 2009 of spun, dyed, and knotted wild flax fibers in a prehistoric cave in the Republic of Georgia shows that the plant was already in use by humans at the surprisingly early date of 30,000 B.C. New Zealand flax is not related to flax but was named after it, as both plants are used to produce fibers.",Spices,Oilseed crops,29226,FOOD00101,NA,4006,Eukaryota,Viridiplantae,Streptophyta,Magnoliopsida,Malpighiales,Linaceae,Linum,NA
F00161,Watercress,Nasturtium officinale,Rorippa nasturtium-aquaticum,"Watercress (Nasturtium officinale), is a fast-growing, aquatic or semi-aquatic, perennial plant native to Europe and Asia, and one of the oldest known leaf vegetables consumed by humans. It is a member of the family Brassicaceae, botanically related to garden cress, mustard and radish — all noteworthy for a peppery, tangy flavour. The hollow stems of watercress are floating, and the leaves are pinnately compound. Small, white and green flowers are produced in clusters.",Vegetables,Leaf vegetables,22993,FOOD00158,683,65948,Eukaryota,Viridiplantae,Streptophyta,Magnoliopsida,Brassicales,Brassicaceae,Nasturtium,"The tender stems and leaves of Watercress are sold in China for vegetable consumption. According to relevant research, the content of vitamin B, vitamin C, and amino acids in Douban is relatively high, and it contains rich nutrients such as protein, carbohydrates, and organic acids, making it a good edible vegetable."
F00162,Grapefruit,Citrus X paradisi,NA,"The grapefruit (Citrus × paradisi) is a subtropical citrus tree known for its sour to semi-sweet fruit, an 18th-century hybrid first bred in Barbados. When found, it was named the ""forbidden fruit""; and it has also been misidentified with the pomelo or shaddock (C. maxima), one of the parents of this hybrid, the other being sweet orange (C. × sinensis). The evergreen grapefruit trees usually grow to around 5?6 meters (16?20 ft) tall, although they can reach 13?15 m (43-49 ft). The leaves are glossy dark green, long (up to 15 centimeters (5.9 in)) and thin. It produces 5 cm (2 in) white four-petaled flowers. The fruit is yellow-orange skinned and generally an oblate spheroid in shape; it ranges in diameter from 10?15 cm (3.9-5.9 in). The flesh is segmented and acidic, varying in color depending on the cultivars, which include white, pink and red pulps of varying sweetness (generally, the redder varieties are sweeter). The 1929 US Ruby Red (of the Redblush variety) has the first grapefruit patent.",Fruits,Citrus,28887,FOOD00256,1856,37656,Eukaryota,Viridiplantae,Streptophyta,Magnoliopsida,Sapindales,Rutaceae,Citrus,NA
F00163,Rocket Salad (Ssp.),Eruca vesicaria ssp. Sativa,NA,"Eruca sativa (syn. E. vesicaria subsp. sativa (Miller) Thell., Brassica eruca L.) is an edible annual plant, commonly known as salad rocket, roquette, rucola, rugula, colewort, and, in the United States, arugula. It is sometimes conflated with Diplotaxis tenuifolia, the perennial wall rocket, another plant of the Brassicaceae family, which in the past was used in the same manner. Eruca sativa, which is widely popular as a salad vegetable, is a species of Eruca native to the Mediterranean region, from Morocco and Portugal in the west to Syria, Lebanon and Turkey in the east. The Latin adjective sativa in the plant's binomial is derived from satum, the supine of the verb sero, meaning ""to sow"", indicating that the seeds of the plant were sown in gardens. Eruca sativa differs from E. vesicaria in having early deciduous sepals. Some botanists consider it a subspecies of Eruca vesicaria: E. vesicaria subsp. sativa. Still others do not differentiate between the two.",Vegetables,Leaf vegetables,524057,FOOD00077,NA,180536,Eukaryota,Viridiplantae,Streptophyta,Magnoliopsida,Brassicales,Brassiceae,Eruca,NA
F00164,Kefir,NA,NA,"Kefir is a fermented milk drink that originated with shepherds of the North Caucasus region, who discovered that fresh milk carried in leather pouches would occasionally ferment into an effervescent beverage. It is prepared by inoculating cow, goat, or sheep's milk with kefir grains. Traditional kefir was made in skin bags that were hung near a doorway; the bag would be knocked by anyone passing through the doorway to help keep the milk and kefir grains well mixed.",Milk and milk products,Fermented milks,NA,FOOD00691,1281,NA,NA,NA,NA,NA,NA,NA,NA,NA
F00165,Brussel Sprouts,Brassica oleracea var. gemmifera,NA,"The Brussels sprout is a cultivar in the Gemmifera group of cabbages, grown for its edible buds. The leafy green vegetables are typically 2.5–4 cm (0.98–1.6 in) in diameter and look like miniature cabbages. The Brussels sprout has long been popular in Brussels, Belgium, and may have originated there.",Vegetables,Cabbages,530959,FOOD00032,1825,178616,Eukaryota,Viridiplantae,Streptophyta,Magnoliopsida,Brassicales,Brassicaceae,Brassica,NA
F00166,Caraway,Carum carvi,NA,"Caraway (Carum carvi), also known as meridian fennel, or Persian cumin, is a biennial plant in the family Apiaceae, native to western Asia, Europe and Northern Africa. The plant is similar in appearance to other members of the carrot family, with finely divided, feathery leaves with thread-like divisions, growing on 20–30 cm stems. The main flower stem is 40–60 cm tall, with small white or pink flowers in umbels. Caraway fruits are crescent-shaped achenes, around 2 mm long, with five pale ridges.",Spices,Spices,29610,FOOD00043,1697,48032,Eukaryota,Viridiplantae,Streptophyta,Magnoliopsida,Apiales,Apiaceae,Carum,"Caraway, a biennial herbaceous plant in the Umbelliferae family, is native to Europe and West Asia. Its fruit is a spice that can be used for cooking or medicine."
F00167,Pummelo,Citrus maxima,NA,"The pomelo (Citrus maxima or Citrus grandis), pummelo, pommelo, or shaddock is a crisp citrus fruit native to South and Southeast Asia. It is usually pale green to yellow when ripe, with sweet white (or, more rarely, pink or red) flesh and very thick albedo (rind pith).",Fruits,Citrus,501574,FOOD00055,NA,37334,Eukaryota,Viridiplantae,Streptophyta,Magnoliopsida,Sapindales,Rutaceae,Citrus,NA
F00168,Tartary Buckwheat,Fagopyrum tataricum,NA,"Tartary buckwheat (Fagopyrum tataricum) also known as duckwheat, India buckwheat, India wheat, green buckwheat, or bitter buckwheat, is a domesticated food plant in the genus Fagopyrum (sometimes merged into the genus Polygonum) in the family Polygonaceae. With another species in the same genus, common buckwheat, it is often counted as a cereal, but unlike the true cereals the buckwheats are not members of the grass family. Thus they are not related to true wheat. Tartary buckwheat is bitterer, but contains more rutin than common buckwheat. It also contains quercitrin. Tartar buckwheat was domesticated in east Asia. While it is unfamiliar to the West, it is still eaten in the Himalayan region today.",Cereals and cereal products,Cereals,21283,FOOD00080,NA,62330,Eukaryota,Viridiplantae,Streptophyta,Magnoliopsida,Caryophyllales,Polygonaceae,Fagopyrum,"In China, as well as in countries such as Japan, North Korea, and Russia, tartary buckwheat has always been a popular delicacy and is known as the ""king of grains""."
F00169,Strawberry,Fragaria X ananassa,NA,"The garden strawberry (or simply strawberry; Fragaria × ananassa) is a widely grown hybrid species of the genus Fragaria (collectively known as the strawberries). It is cultivated worldwide for its fruit. The fruit (which is not a botanical berry, but an aggregate accessory fruit) is widely appreciated for its characteristic aroma, bright red color, juicy texture, and sweetness. It is consumed in large quantities, either fresh or in such prepared foods as preserves, fruit juice, pies, ice creams, milkshakes, and chocolates. Artificial strawberry aroma is also widely used in many industrial food products. As strawberry flavor and fragrance are popular characteristics for consumers,they are used widely in a variety of manufacturing, including foods, beverages, confections, perfumes and cosmetics. ",Fruits,Berries,24630,FOOD00083,1,3747,Eukaryota,Viridiplantae,Streptophyta,Magnoliopsida,Rosales,Rosaceae,Fragaria,NA
F00170,Lettuce,Lactuca sativa,NA,"Today, the majority of lettuce is grown for its leaves, although one type is grown for its stem and one for its seeds, which are made into an oil. Most lettuce is used in salads, either alone or with other greens, vegetables, meats and cheeses. Romaine lettuce is often used for Caesar salads, with a dressing that includes anchovies and eggs. Lettuce leaves can also be found in soups, sandwiches and wraps, while the stems are eaten both raw and cooked.",Vegetables,Leaf vegetables,36607,FOOD00095,591,4236,Eukaryota,Viridiplantae,Streptophyta,Magnoliopsida,Asterales,Asteraceae,Lactuca,NA
F00171,Apricot,Prunus armeniaca,NA,"An apricot is a fruit or the tree that bears the fruit. Usually, an apricot tree is from the tree species Prunus armeniaca, but the species Prunus brigantina, Prunus mandshurica, Prunus mume, and Prunus sibirica are closely related, have similar fruit, and are also called apricots.",Fruits,Drupes,24769,FOOD00144,1851,36596,Eukaryota,Viridiplantae,Streptophyta,Magnoliopsida,Rosales,Rosaceae,Prunus,NA
F00172,Almond,Prunus dulcis,NA,"The almond (Prunus dulcis, syn. Prunus amygdalus, Amygdalus communis, Amygdalus dulcis) is a species of tree native to the Middle East and South Asia. ""Almond"" is also the name of the edible and widely cultivated seed of this tree.",Nuts,Nuts,24775,FOOD00148,35,3755,Eukaryota,Viridiplantae,Streptophyta,Magnoliopsida,Rosales,Rosaceae,Prunus,"Almonds are widely used in fields such as food, cosmetics, and medicine."
F00173,Guava,Psidium guajava,NA,"Guavas (singular guava) are plants in the Myrtle family (Myrtaceae) genus Psidium, which contains about 100 species of tropical shrubs and small trees. Guava juice is popular in many countries. The fruit is also often prepared in fruit salads.",Fruits,Tropical fruits,27240,FOOD00150,633,120290,Eukaryota,Viridiplantae,Streptophyta,Magnoliopsida,Myrtales,Myrtaceae,Psidium,NA
F00174,Radish,Raphanus sativus,NA,"The radish (Raphanus sativus) is an edible root vegetable of the Brassicaceae family that was domesticated in Europe in pre-Roman times. They are grown and consumed throughout the world. Radishes have numerous varieties, varying in size, color and duration of required cultivation time. There are some radishes that are grown for their seeds; oilseed radishes are grown, as the name implies, for oil production. Radish can sprout from seed to small plant in as little as 3 days.",Vegetables,Root vegetables,23290,FOOD00153,39,3726,Eukaryota,Viridiplantae,Streptophyta,Magnoliopsida,Brassicales,Brassicaceae,Raphanus,NA
F00175,Rowanberry,Sorbus aucuparia,NA,"Sorbus aucuparia, commonly called rowan and mountain-ash, is a species of deciduous tree or shrub in the rose family. It is a highly variable species, and botanists have used different definitions of the species to include or exclude trees native to certain areas; a recent definition includes trees native to most of Europe and parts of Asia, as well as northern Africa. The range extends from Madeira and Iceland to Russia and northern China. Unlike many plants with similar distributions, it is not native to Japan. Fruit and foliage of S. aucuparia have been used by humans in the creation of dishes and beverages, as a folk medicine, and as fodder for livestock.",Fruits,Berries,25320,FOOD00176,NA,36599,Eukaryota,Viridiplantae,Streptophyta,Magnoliopsida,Rosales,Rosaceae,Sorbus,"Rowanberry fruits are rich in minerals, crude fiber, vitamin C, and can be used as raw materials for foods and beverages such as fruit juice, jam, canned goods, and preserved fruits."
F00176,Hazelnut,Corylus,NA,"A hazelnut is the nut of the hazel and is also known as cobnut or filbert nut according to species. The kernel of the seed is edible and used raw or roasted, or ground into a paste. Hazelnuts are also used for livestock feed, as are chestnuts and acorns. The seed has a thin, dark brown skin, which is sometimes removed before cooking. Hazelnuts are rich in protein and unsaturated fat. Moreover, they contain significant amounts of thiamine and vitamin B6, as well as smaller amounts of other B vitamins.",Nuts,Nuts,19505,FOOD00376,302,13450,Eukaryota,Viridiplantae,Streptophyta,Magnoliopsida,Fagales,Betulaceae,No Rank at Level Genus,NA
F00177,Potassium,NA,NA,"Potassium is an important electrolyte and the third most abundant mineral in the human body, playing many important functions, such as balancing fluid and mineral levels in the body. Foods rich in potassium include avocados, bananas, avocados, spinach, etc",Others,Element,NA,NA,NA,NA,NA,NA,NA,NA,NA,NA,NA,NA
F00178,Tyramine,NA,NA,"Some foods are naturally higher in tyramine. Tyramine levels also increase when food is aged or fermented. Your amount will depend on your symptoms, medical history, and medications. Some foods high in tyramine include:Aged cheeses, Alcohol (wine and beer), Cured meat and processed meat (salami, sausage, bacon, cold cuts), Concentrated yeast (marmite, vegemite), Coffee, Chocolate, Soy sauce, teriyaki sauce, miso, Fermented foods (kimchi, sauerkraut, kefir, tofu), Aged bananas, avocado, grapes, citrus fruits.",Others,Chemical Compound,NA,NA,NA,NA,NA,NA,NA,NA,NA,NA,NA,NA
F00179,Fish Oil,NA,NA,"Fish oil is oil derived from the tissues of oily fish. Fish oils contain the omega-3 fatty acids eicosapentaenoic acid (EPA) and docosahexaenoic acid (DHA), precursors of certain eicosanoids that are known to reduce inflammation in the body and improve hypertriglyceridemia. Fish oil has been shown the benefit for cardiovascular disease. The most promising evidence supports supplementation for prevention of cardiac death.",Aquatic foods,Fishes,NA,FOOD00990,85,NA,NA,NA,NA,NA,NA,NA,NA,NA
F00180,Lemon Balm,Melissa officinalis,NA,"Lemon balm (Melissa officinalis), not to be confused with bee balm (which is genus Monarda), is a perennial herb in the mint family Lamiaceae, native to southern Europe and the Mediterranean region. It grows to 70–150 cm tall. The leaves have a gentle lemon scent, related to mint. During summer, small white flowers full of nectar appear. These attract bees, hence the genus name Melissa (Greek for 'honey bee'). Its flavour comes from citronellal (24%), geranial (16%), linalyl acetate (12%) and caryophyllene (12%).",Beverages,Flower tea,32565,FOOD00108,NA,39338,Eukaryota,Viridiplantae,Streptophyta,Magnoliopsida,Lamiales,Lamiaceae,Melissa,"Lemon Balm can be used as a raw material for incense, tea making, pickling, and stewing."
F00181,Arabica Coffee,Coffea arabica,NA,"Coffea arabica is a species of Coffea originally indigenous to the mountains of the southwestern highlands of Ethiopia. It is also known as the ""coffee shrub of Arabia"", ""mountain coffee"" or ""arabica coffee"". Coffea arabica is believed to be the first species of coffee to be cultivated, being grown in southwest Ethiopia for well over 1,000 years. It is said to produce better tasting coffee than the other major commercially grown coffee species, Coffea canephora (robusta), because robusta cherries contain twice as much caffeine as arabica. Caffeine itself has a bitter taste, making robusta more bitter. C. arabica contains less caffeine than any other commercially cultivated species of coffee.",Coffee and coffee products,Coffee,35190,FOOD00059,NA,13443,Eukaryota,Viridiplantae,Streptophyta,Magnoliopsida,Gentianales,Rubiaceae,Coffea,NA
F00182,Cocoa Bean,Theobroma cacao,NA,"Cocoa bean (also cacao bean, often simply cocoa and cacao; Mayan: kakaw; Nahuatl: cacaua) is the dried and fully fermented fatty seed of Theobroma cacao, from which cocoa solids and cocoa butter are extracted. They are the basis of chocolate, as well as many Mesoamerican foods such as mole sauce and tejate.",Coffee and coffee products,Coffee,505487,FOOD00182,NA,3641,Eukaryota,Viridiplantae,Streptophyta,Magnoliopsida,Malvales,Malvaceae,Theobroma,NA
F00183,Bog Bilberry,Vaccinium uliginosum,NA,"Vaccinium uliginosum (Bog Bilberry or Northern Bilberry) is a flowering plant in the genus Vaccinium. The fruit is a dark blue-black berry 5–8 millimetres (0.20–0.31 in) diameter, with a white flesh, edible and sweet when ripe in late summer.",Fruits,Berries,23574,FOOD00212,NA,190548,Eukaryota,Viridiplantae,Streptophyta,Magnoliopsida,Ericales,Ericaceae,Vaccinium,NA
